{
  "schema_version": "1.0",
  "gate": "H1",
  "status": "TEAM_APPROVED",
  "question": "确认与现有统一相容候选模型体系一致的题意、目标、硬约束、错误代价和关键假设",
  "selected_options": [
    "H1-v2-1：采用统一二维轴对称守恒母模型组织Q1—Q4；一维径向模型作为该母模型的严格降阶基线和公平对照，不再作为Q2—Q4的默认主路线",
    "H1-v2-2：候选模型统一定义为M1一维基础模型、M2二维基础传输模型、M3二维状态相关非线性模型、M4二维热湿耦合模型；候选必须在适当参数极限下逐级退化并共享物理口径",
    "H1-v2-3：Q1同时运行M1与M2以量化端面及轴向效应；Q2以M3为主要候选、Q3以M3/M4为主要候选，但复杂机制只有达到预注册保留门槛后才可保留",
    "H1-v2-4：Q4复用经Q1—Q3验证的统一求解器，在r∈[0,R(t)]收缩域上完成题目规定的全域达标时间和场量输出；预测或优化只能作为完成强制前向问题后的条件性扩展，不得替代原题交付",
    "H1-v2-5：所有候选共享附件数据、初始条件、边界条件、物性关系、插值延拓规则、阈值、评价时空网格、误差指标和计算预算；仅允许改变空间维度、保留机制、物性复杂度及明确声明的耦合项",
    "H1-v2-6：状态变量严格区分材料干基含水率X、相对湿度φ、水蒸气浓度cv、水蒸气分压pv和温度T；只有存在题设或可核验平衡关系时才转换，模型输出必须先转换到与附件相同的物理量后评价",
    "H1-v2-7：空间离散统一优先采用守恒有限体积法，时间离散采用稳定隐式格式；计算网格与评价网格分离，并通过局部/全局守恒、边界残差、网格和时间步收敛校验",
    "H1-v2-8：保留已批准的数据口径：初始T=28°C、C=2.55 kg/kg；0—4 h温湿边界分段线性、R(t)采用PCHIP、4 h后采用末段稳健统计量延拓；问题2—4沿用h=25 W/(m²·K)和hm=8×10^-7 m/s",
    "H1-v2-9：问题3与问题4均采用全域max C<0.15 kg/kg停止判据，比较容差ε=10^-6 kg/kg，报告精度60 s并局部加密夹逼；result1—result4的时间、空间、单位和域外NA口径保持不变",
    "H1-v2-10：完整多孔多相CFD、PINN、GNN、神经算子和纯机器学习不与M1—M4直接平行竞争；只有基础PDE已经可信且出现明确缺陷、具备足量高保真数据并满足独立保留门槛时才可作为后续扩展"
  ],
  "reasons": [
    "林子垚已重写候选模型方案，并明确要求H1与该统一相容模型体系一致后先进行PROTOTYPE。",
    "统一二维母模型和M1—M4嵌套关系可以让Q1—Q4共享变量、边界、参数和评价口径，减少各问独立建模造成的物理与数值不一致。",
    "保留一维降阶基线、逐级复杂度门槛和统一计算预算，可用真实原型结果判断二维、非线性和耦合机制是否值得保留，而不是预设复杂模型必然更优。",
    "Q4仍必须首先满足A题规定的收缩移动域、全域阈值与结果文件要求，避免预测或优化扩展改变原题。"
  ],
  "accepted_assumptions": [
    "圆柱初始长度25 cm、半径2 cm；二维轴对称母模型包含径向和轴向变化，一维径向模型是轴向均匀极限下的严格降阶。",
    "初始温度场和干基含水率场均匀；该均匀性不延伸到烘干过程。",
    "问题2—4未另给对流系数，沿用问题1给定的h和hm，并对其扰动进行敏感性分析。",
    "4 h后烘房环境进入准稳态，以末段窗口统计值延拓；窗口长度不确定性必须显式评估。",
    "问题4继承问题3的C<0.15 kg/kg全域停止判据，并以附件2的R(t)定义移动边界。",
    "同名物理参数在候选模型中保持相同定义；若重新标定，必须明确标为模型有效参数，并同时报告固定参数比较与重新标定比较。",
    "预测或优化扩展仅在题面强制前向结果完成、决策变量和约束有明确依据时启用。",
    "题设经验式仅用于本题条件性仿真，不外推为普适材料规律。"
  ],
  "rejected_options": [
    "把各小问建立为物理量、边界口径或参数定义互不相容的独立模型。",
    "把一维径向模型作为Q2—Q4无需二维对照的默认主模型。",
    "沿用旧版M1固定参考域、M2移动有限体积作为模型层级名称；两种移动域离散可保留为同一物理模型下的数值实现对照。",
    "未经原型证据直接宣布M2、M3或M4优于更简单候选。",
    "用普通三次样条或附件1末端PCHIP导数对4 h后温湿边界作无约束外推。",
    "以固定2 cm域、平均半径替换或仅中心/表面点判定解决问题4。",
    "让预测优化、PINN、GNN、神经算子或纯机器学习替代A题要求的守恒方程、移动边界和强制输出。",
    "把‘选择A题的人少’写成论文事实或获奖概率依据。"
  ],
  "required_validations": [
    "在相同输入、参数、评价网格、误差指标和资源预算下公平比较M1与M2，量化一维—二维差异、端面效应、运行时间和网格误差。",
    "分别检验M3相对M2的状态相关物性增益及M4相对M3的耦合增益；增益低于预注册门槛、仅属数值噪声或引入不可识别参数时回退。",
    "验证状态变量和单位转换、Kelvin/摄氏温标、初值、轴心对称、Robin边界符号与残差。",
    "完成局部与全局质量/能量平衡、三级网格和时间步收敛，并记录非线性迭代失败与非物理解。",
    "对Q4执行常半径回归、R(t)再现、正体积/Jacobian、移动域干固体连续性、域外NA掩码和移动网格修正消融。",
    "对Q3/Q4的C<0.15 kg/kg首次事件进行阈值前后夹逼，确认60 s报告时刻在继续加密后不改变。",
    "对4 h后统计窗口、h、hm及经验式参数做有界敏感性和组合稳健性分析，报告任何候选排序反转。",
    "检查result1—result4与论文表格使用同一权威结果源，时间行、空间列、单位和域外NA口径一致。",
    "任何预测或优化扩展必须先给出题面依据、决策变量、目标、约束、前向求解器误差和额外验证，不得用扩展结果替代强制交付。",
    "提交前核验2026中国知网客户端、具体赛区上传时段及附加要求。"
  ],
  "prohibited_changes": [
    "未经重新开启H0并取得团队批准，不得更换A题。",
    "未经重新开启H1并取得团队批准，不得改变统一二维母模型口径、状态变量定义、初始场、边界延拓、传质势差、停止判据或结果表口径。",
    "PROTOTYPE完成并形成H2选择包前，不得宣布M1—M4中的任何候选为最终路线。",
    "不得把尚未实现或未测试的二维、非线性、耦合、优化、PINN、GNN或代理模型描述为已验证改进。",
    "不得将未验证的参赛人数判断、因果关系或普适材料参数写成事实。",
    "不得用下游论文措辞掩盖上游计算、守恒、收敛、迁移或证据缺陷。"
  ],
  "delegations": [],
  "confirmed_by": [
    "林子垚"
  ],
  "confirmed_at": "2026-09-11T14:57:29+08:00",
  "supersedes": "decisions/H1-problem-v1.json"
}
