{
  "schema_version": "1.0",
  "gate": "H1",
  "status": "TEAM_APPROVED",
  "question": "确认题意、目标、硬约束、错误代价和关键假设",
  "selected_options": [
    "保留15项独立验收任务",
    "异常测量采用原始数据基线与有依据掩码的成对敏感性分析，暂不删点",
    "折射率先保留符号或参数区间分析",
    "多光束结论采用存在、未获支持、证据不足三态",
    "可靠性区分内部一致性与真实准确度",
    "仅在机制证据及厚度影响均获支持时触发多光束修正",
    "按具体物理缺陷增量改进并保留简单基线"
  ],
  "reasons": [
    "队长明确选择折射率缺口的后者，即先保留符号或参数区间分析；其他决策项采用H1选择包的非约束性建议。",
    "该组合避免在文献和数据证据不足时任取折射率或强行得出唯一厚度，同时保留针对明确基准缺陷逐步改进的路线。"
  ],
  "accepted_assumptions": [
    "研究题目为2025年B题，论文与合规要求按2026全国规定执行。",
    "一次反射透射的两束干涉仅作为后续可检验的最低可信基线，不等于最终模型。",
    "折射率先作符号或参数区间处理，后续仍须由文献核验其物理依据和适用范围。",
    "无独立厚度真值时，双角度、跨波段和参数稳定性只能支持内部可靠性，不能直接证明真实准确度。"
  ],
  "rejected_options": [
    "不在H1直接任取固定折射率并报告唯一物理厚度。",
    "不使用仅有存在或不存在的强制二态多光束结论。",
    "不直接删除异常测量点，也不把共享参数联合拟合结果冒充独立跨角验证。",
    "不为增加复杂度而保留不能解决明确基准缺陷或没有可证伪增益的模块。"
  ],
  "required_validations": [
    "从用户提供或合法取得的文献中核验SiC与Si折射率、色散、吸收、掺杂和适用波段。",
    "使用原始数据与有依据掩码进行成对敏感性分析，特别审计附件2中反射率超过100%的262个点及四表首个零值。",
    "分别检查双角度、跨窗口、参数敏感性、合成恢复、量纲和退化极限。",
    "在比较前固定多光束证据阈值、可接受厚度差异和参数边界，不得从最终结果倒推。",
    "队长后续核验赛区和学校附加要求，并逐项人工审查、修改和验证AI产物。"
  ],
  "prohibited_changes": [
    "未经新的团队决议不得更换B题或改变2026规则基线。",
    "不得把折射率符号化解释为免除后续文献核验，也不得在H1冻结最终模型或算法。",
    "不得把证据不足写成多光束不存在，不得把残差改善写成真实精度提升。",
    "不得在用户提供至少一份受支持文献之前启动LITERATURE，更不得跳过LITERATURE进入DESIGN。"
  ],
  "delegations": [],
  "confirmed_by": [
    "队长"
  ],
  "confirmed_at": "2026-09-05T20:22:19+08:00",
  "supersedes": null
}
