{
  "schema_version": "1.0",
  "gate": "H2",
  "status": "TEAM_APPROVED",
  "question": "选择正式计算的主模型、基线、诊断模块、参数表达和验证口径",
  "selected_options": [
    "B局部条纹两束模型作为必须保留的基准",
    "F等距波数FFT作为正式计算主模型",
    "P物理谱约束回归仅作补充诊断，不覆盖F的主结果",
    "M多光束模型保持关闭，只有机制证据和稳定显著厚度影响同时满足时才可重新申请准入",
    "固定使用600–1600、1600–2800、2800–3800 cm^-1三个窗口并全部报告，不按结果挑选窗口",
    "折射率证据不足时优先报告光学厚度q和条件表达d(n)，仅做透明区间敏感性，不声称唯一真实厚度",
    "正式验证采用合成恢复、跨窗口稳定性、双角独立一致性、原始与掩码敏感性、失败率和频率分辨率"
  ],
  "reasons": [
    "队长明确表示全部按主控在H2选择包后的建议执行。",
    "预注册原型中F合成通过率为100%，相对B逐案例胜率79.86%，达到支持门槛；P为73.61%，未达到75%门槛；M的双重准入门未触发。",
    "该路线保留最低复杂度基准，只保留有针对性证据支持的改进，并诚实处理折射率与真实厚度不可识别问题。"
  ],
  "accepted_assumptions": [
    "继续采用prototype-authorization.json中A1–A7的受限版本。",
    "空气折射率取1并进行角度误差敏感性分析。",
    "双角观测共享同一物理厚度，但先独立估计；联合拟合不得作为独立验证。",
    "基线窗口内暂忽略吸收；不得外推其他样品的吸收或折射率参数。",
    "模型门槛保持预注册，禁止根据正式结果回调。"
  ],
  "rejected_options": [
    "不采用B作为唯一主模型。",
    "不把P升级为正式主模型，也不因其中位误差较低而事后放宽胜率门槛。",
    "不在现有证据下启用M或进行SiC多光束厚度修正。",
    "不根据计算结果反选窗口或异常数据版本。",
    "不任取单一折射率并报告唯一真实厚度。"
  ],
  "required_validations": [
    "完整复现B与F并保留P补充诊断和全部失败码。",
    "三个固定窗口、两个角度以及原始/有依据掩码必须成对报告。",
    "运行合成恢复、跨窗口、双角独立一致性、折射率与角度敏感性、FFT频率分辨率和退化极限检查。",
    "所有厚度结果必须区分光学厚度、给定折射率下的条件厚度和真实厚度准确性。",
    "若出现超出A1–A7的新假设需求，必须停止并提前征求队长批准。"
  ],
  "prohibited_changes": [
    "未经新的团队决议不得更换F主模型、改变三个固定窗口或启用M。",
    "不得把联合双角拟合、跨窗口稳定或残差下降描述为独立真值验证。",
    "不得从L03的非线性折射率n2或L01的其他样品参数推定本题线性n/k。",
    "不得隐藏B/P失败、附件2超过100%的点或四表首个零值的敏感性结果。"
  ],
  "delegations": [],
  "confirmed_by": ["队长"],
  "confirmed_at": "2026-09-07T19:01:20+08:00",
  "supersedes": null
}
